{
  "$schema" : "https://raw.githubusercontent.com/line/decaton/{DECATON_VERSION}/centraldogma/src/jsonschema/dist/decaton-processor-properties-central-dogma-schema-draft_7.json",
  "decaton.ignore.keys" : [ ],
  "decaton.processing.rate.per.partition" : -1,
  "decaton.partition.concurrency" : 1,
  "decaton.max.pending.records" : 10000,
  "decaton.commit.interval.ms" : 1000,
  "decaton.group.rebalance.timeout.ms" : 1000,
  "decaton.processing.shutdown.timeout.ms" : 0,
  "decaton.logging.mdc.enabled" : true,
  "decaton.client.metrics.micrometer.bound" : false,
  "decaton.deferred.complete.timeout.ms" : -1,
  "decaton.processor.threads.termination.timeout.ms" : 9223372036854775807,
  "decaton.per.key.quota.processing.rate" : -1,
  "decaton.retry.task.in.legacy.format" : false,
  "decaton.legacy.parse.fallback.enabled" : false
}
